{
  "analysis_records": [
    {
      "record_id": "AR-1",
      "scenario_id": "RS-1",
      "approach_ids": [
        "AP-3",
        "AP-5"
      ],
      "evidence_ids": [
        "AE-1",
        "AE-2",
        "AE-3",
        "AE-6",
        "AE-7",
        "AE-11"
      ],
      "scenario_reference": {
        "id": "RS-1",
        "text": "When a user attempts unauthorized access, the system prevents access to the system.",
        "type": "utility-tree"
      },
      "quality_attribute": "Security",
      "environment": "During normal system use",
      "stimulus": "A user attempts unauthorized access",
      "response_measure": "unspecified (see gap G-4-1)",
      "architectural_decisions": [
        "The framework keeps application logic embedded within framework components.",
        "The Event Manager interacts directly with application handlers.",
        "The framework is intended to be used by an application and to let application components utilize framework services."
      ],
      "reasoning": "The evidence supports an integrated framework/application structure, but it does not describe any authorization mechanism, access-control boundary, or confidentiality control. Therefore, the architecture decisions explain how the system is organized, but they do not show how unauthorized access is prevented. Because the response measure is missing, the scenario cannot be judged against a measurable security threshold; this is inferred from the absence of a security requirement in the inputs.",
      "findings": {
        "risks": [
          {
            "id": "R-1",
            "description": "No security control or authorization mechanism is described for preventing unauthorized access through the framework/application interaction path.",
            "rationale": "The architecture evidence describes event management, handler interaction, and framework reuse, but not authentication, authorization, or confidentiality controls. For this security scenario, the absence of a stated access-control mechanism is a risk because the inputs do not support the conclusion that unauthorized access is prevented.",
            "basis": "inferred",
            "evidence_ids": [
              "AE-1",
              "AE-3",
              "AE-11"
            ]
          }
        ],
        "non_risks": [],
        "sensitivity_points": [],
        "tradeoff_points": []
      }
    },
    {
      "record_id": "AR-2",
      "scenario_id": "RS-2",
      "approach_ids": [
        "AP-1",
        "AP-2"
      ],
      "evidence_ids": [
        "AE-4",
        "AE-8",
        "AE-9",
        "AE-10",
        "AE-12",
        "AE-13",
        "AE-14"
      ],
      "scenario_reference": {
        "id": "RS-2",
        "text": "When the system processes operations, it processes them in the fastest possible speed.",
        "type": "utility-tree"
      },
      "quality_attribute": "Performance",
      "environment": "During normal operation",
      "stimulus": "The system processes operations",
      "response_measure": "unspecified (see gap G-4-2)",
      "architectural_decisions": [
        "The system uses a single Event Manager and a single Event Queue.",
        "Events are dispatched in FIFO order on a single processor.",
        "The system maintains an idle-wait state until input arrives."
      ],
      "reasoning": "The performance proxy is the number of components involved in a transaction, and the documented architecture centralizes event handling through one manager, one queue, and sequential processing. That reduces coordination complexity, but the evidence also says transaction speed is qualitatively slow due to the high number of components involved. Therefore, the architecture supports predictable processing, yet it does not support a claim of fastest-possible speed; instead, the evidence suggests the opposite direction. This is an inferred judgment from the component-count proxy and the sequential dispatch model.",
      "findings": {
        "risks": [
          {
            "id": "R-2",
            "description": "Single-processor FIFO processing may pose a performance risk, but the available evidence does not establish whether the architecture meets a fastest-possible-speed expectation.",
            "rationale": "The inputs describe single-processor sequential event processing, FIFO dispatch, and qualitative transaction speed as slow when many components are involved. This suggests a potential performance risk; no workload, benchmark, or response-time target is supplied, so whether the scenario is met cannot be determined.",
            "basis": "inferred",
            "evidence_ids": [
              "AE-8",
              "AE-9",
              "AE-12",
              "AE-13",
              "AE-14"
            ]
          }
        ],
        "non_risks": [],
        "sensitivity_points": [
          {
            "id": "S-1",
            "parameter": "Number of components involved in a transaction",
            "correlated_attribute": "Performance",
            "evidence_ids": [
              "AE-12",
              "AE-13"
            ]
          }
        ],
        "tradeoff_points": [
          {
            "id": "T-1",
            "parameter": "Single-processor FIFO event dispatch",
            "conflicting_attributes": [
              "Reliability (+)",
              "Performance (-)"
            ],
            "evidence_ids": [
              "AE-8",
              "AE-9",
              "AE-13"
            ]
          }
        ]
      }
    },
    {
      "record_id": "AR-3",
      "scenario_id": "RS-3",
      "approach_ids": [
        "AP-1",
        "AP-2"
      ],
      "evidence_ids": [
        "AE-4",
        "AE-8",
        "AE-9",
        "AE-10",
        "AE-14"
      ],
      "scenario_reference": {
        "id": "RS-3",
        "text": "When a failure occurs, the system recovers immediately.",
        "type": "utility-tree"
      },
      "quality_attribute": "Reliability",
      "environment": "During system operation",
      "stimulus": "A failure occurs",
      "response_measure": "unspecified (see gap G-4-3)",
      "architectural_decisions": [
        "The system uses a single Event Manager and a single Event Queue.",
        "Events are processed sequentially on one processor in FIFO order.",
        "The system waits idle until input is received."
      ],
      "reasoning": "The centralized event path and sequential dispatch provide a controlled processing model, which supports predictable behavior after normal events. However, the inputs do not describe any failover, retry, checkpointing, or recovery mechanism. Since the scenario requires immediate recovery after failure, the absence of explicit recovery support is decisive and must be treated as a gap-driven risk rather than an observed capability. The result is an inferred risk from the missing recovery mechanism.",
      "findings": {
        "risks": [
          {
            "id": "R-3",
            "description": "No failover, retry, or recovery mechanism is described to support immediate recovery after a failure.",
            "rationale": "The architecture evidence explains event dispatch and idle waiting, but not how the system detects failure or restores service immediately. For a recovery scenario, the missing mechanism is a risk because immediate recovery cannot be shown from the available evidence.",
            "basis": "inferred",
            "evidence_ids": [
              "AE-4",
              "AE-8",
              "AE-9",
              "AE-10",
              "AE-14"
            ]
          }
        ],
        "non_risks": [],
        "sensitivity_points": [],
        "tradeoff_points": []
      }
    },
    {
      "record_id": "AR-4",
      "scenario_id": "RS-4",
      "approach_ids": [
        "AP-1",
        "AP-2",
        "AP-3"
      ],
      "evidence_ids": [
        "AE-1",
        "AE-3",
        "AE-4",
        "AE-8",
        "AE-9",
        "AE-10",
        "AE-11",
        "AE-14"
      ],
      "scenario_reference": {
        "id": "RS-4",
        "text": "When a user makes an error in using the system, the system handles the error.",
        "type": "utility-tree"
      },
      "quality_attribute": "Functionality",
      "environment": "During normal use",
      "stimulus": "A user makes an error in using the system",
      "response_measure": "unspecified (see gap G-4-4)",
      "architectural_decisions": [
        "The Event Manager interacts directly with application handlers.",
        "The framework uses a single event-management path with FIFO dispatch.",
        "Application logic is embedded within framework components."
      ],
      "reasoning": "The architecture can route input through handlers and a centralized event path, so user-error handling is at least structurally possible. But the inputs do not describe validation, exception handling, or a specific error-recovery policy for invalid user actions. Therefore, the scenario is only partially supported: the framework path exists, yet the actual error-handling behavior is not evidenced. This is inferred because the inputs show the interaction path but not the error policy.",
      "findings": {
        "risks": [
          {
            "id": "R-4",
            "description": "The architecture does not explicitly describe validation or error-recovery behavior for user mistakes.",
            "rationale": "Although event handlers and direct framework/application interaction exist, the evidence does not state how invalid input or user mistakes are detected and corrected. That missing behavior is a risk for the user-error scenario.",
            "basis": "inferred",
            "evidence_ids": [
              "AE-3",
              "AE-4",
              "AE-9",
              "AE-11"
            ]
          }
        ],
        "non_risks": [],
        "sensitivity_points": [],
        "tradeoff_points": []
      }
    },
    {